{
  "$schema": "https://json-schema.org/draft/2020-12/schema",
  "$id": "https://example.invalid/code-migration/2/missions-v4-pack-request.schema.json",
  "title": "Code Migration Missions v4 Pack Request",
  "type": "object",
  "required": [
    "schemaVersion",
    "migrationId",
    "repository",
    "plan",
    "g1JudgeQualification",
    "g2Approval",
    "migrationArtifacts"
  ],
  "properties": {
    "schemaVersion": {
      "const": "code-migration-missions-v4-2"
    },
    "migrationId": {
      "$ref": "#/$defs/id"
    },
    "repository": {
      "$ref": "#/$defs/repository"
    },
    "plan": {
      "$ref": "#/$defs/plan"
    },
    "g1JudgeQualification": {
      "$ref": "#/$defs/judgeQualification"
    },
    "g2Approval": {
      "$ref": "#/$defs/approval"
    },
    "migrationArtifacts": {
      "$ref": "#/$defs/migrationArtifacts"
    }
  },
  "additionalProperties": false,
  "$defs": {
    "id": {
      "type": "string",
      "pattern": "^[A-Za-z0-9][A-Za-z0-9._-]{0,127}(?![\\s\\S])"
    },
    "nonEmptyString": {
      "type": "string",
      "minLength": 1
    },
    "absolutePath": {
      "type": "string",
      "pattern": "^/"
    },
    "sha256": {
      "type": "string",
      "pattern": "^sha256:[0-9a-f]{64}(?![\\s\\S])"
    },
    "commit": {
      "type": "string",
      "pattern": "^(?:[0-9a-f]{40}|[0-9a-f]{64})(?![\\s\\S])"
    },
    "repository": {
      "type": "object",
      "required": ["canonicalRealPath", "baselineCommit"],
      "properties": {
        "canonicalRealPath": {
          "$ref": "#/$defs/absolutePath"
        },
        "baselineCommit": {
          "$ref": "#/$defs/commit"
        }
      },
      "additionalProperties": false
    },
    "artifactIdentity": {
      "type": "object",
      "required": ["artifactRef", "digest"],
      "properties": {
        "artifactRef": {
          "$ref": "#/$defs/nonEmptyString"
        },
        "digest": {
          "$ref": "#/$defs/sha256"
        }
      },
      "additionalProperties": false
    },
    "structurePreservingRouteArtifacts": {
      "type": "object",
      "required": ["rulebook", "gapInventory"],
      "properties": {
        "rulebook": {
          "$ref": "#/$defs/artifactIdentity"
        },
        "gapInventory": {
          "$ref": "#/$defs/artifactIdentity"
        }
      },
      "additionalProperties": false
    },
    "sameStackRouteArtifacts": {
      "type": "object",
      "required": ["deltaCatalog"],
      "properties": {
        "deltaCatalog": {
          "$ref": "#/$defs/artifactIdentity"
        }
      },
      "additionalProperties": false
    },
    "redesignRouteArtifacts": {
      "type": "object",
      "required": ["behaviorCatalog", "targetArchitecture"],
      "properties": {
        "behaviorCatalog": {
          "$ref": "#/$defs/artifactIdentity"
        },
        "targetArchitecture": {
          "$ref": "#/$defs/artifactIdentity"
        }
      },
      "additionalProperties": false
    },
    "routeArtifacts": {
      "oneOf": [
        {
          "$ref": "#/$defs/structurePreservingRouteArtifacts"
        },
        {
          "$ref": "#/$defs/sameStackRouteArtifacts"
        },
        {
          "$ref": "#/$defs/redesignRouteArtifacts"
        }
      ]
    },
    "step": {
      "type": "object",
      "required": ["id", "command", "expectedExit"],
      "properties": {
        "id": {
          "$ref": "#/$defs/id"
        },
        "command": {
          "$ref": "#/$defs/nonEmptyString"
        },
        "expectedExit": {
          "enum": ["zero", "nonzero"]
        }
      },
      "additionalProperties": false
    },
    "judgeQualification": {
      "type": "object",
      "required": ["artifact", "knownGood", "knownBad", "restoration"],
      "properties": {
        "artifact": {
          "$ref": "#/$defs/artifactIdentity"
        },
        "knownGood": {
          "$ref": "#/$defs/step"
        },
        "knownBad": {
          "$ref": "#/$defs/step"
        },
        "restoration": {
          "$ref": "#/$defs/step"
        }
      },
      "additionalProperties": false
    },
    "approval": {
      "type": "object",
      "required": ["artifact", "approvedBy", "approvedAt"],
      "properties": {
        "artifact": {
          "$ref": "#/$defs/artifactIdentity"
        },
        "approvedBy": {
          "$ref": "#/$defs/id"
        },
        "approvedAt": {
          "type": "string",
          "pattern": "^\\d{4}-\\d{2}-\\d{2}T\\d{2}:\\d{2}:\\d{2}(?:\\.\\d+)?(?:Z|[+-]\\d{2}:\\d{2})(?![\\s\\S])"
        }
      },
      "additionalProperties": false
    },
    "budgets": {
      "type": "object",
      "required": ["maxAttemptsPerFeature", "maxRepairRoundsPerMilestone"],
      "properties": {
        "maxAttemptsPerFeature": {
          "type": "integer",
          "minimum": 1,
          "maximum": 20
        },
        "maxRepairRoundsPerMilestone": {
          "type": "integer",
          "minimum": 0,
          "maximum": 20
        }
      },
      "additionalProperties": false
    },
    "textItem": {
      "type": "object",
      "required": ["id", "text"],
      "properties": {
        "id": {
          "$ref": "#/$defs/id"
        },
        "text": {
          "$ref": "#/$defs/nonEmptyString"
        }
      },
      "additionalProperties": false
    },
    "reviewPolicy": {
      "type": "object",
      "required": ["scrutiny", "checklist"],
      "properties": {
        "scrutiny": {
          "enum": ["required", "not_applicable"]
        },
        "checklist": {
          "type": "array",
          "maxItems": 256,
          "items": {
            "$ref": "#/$defs/textItem"
          }
        }
      },
      "additionalProperties": false
    },
    "plan": {
      "type": "object",
      "required": ["id", "revision", "phase", "milestone", "units", "budgets", "reviewPolicy"],
      "properties": {
        "id": {
          "$ref": "#/$defs/id"
        },
        "revision": {
          "type": "integer",
          "minimum": 1
        },
        "phase": {
          "$ref": "#/$defs/id"
        },
        "milestone": {
          "$ref": "#/$defs/id"
        },
        "budgets": {
          "$ref": "#/$defs/budgets"
        },
        "reviewPolicy": {
          "$ref": "#/$defs/reviewPolicy"
        },
        "units": {
          "type": "array",
          "minItems": 1,
          "maxItems": 512,
          "items": {
            "$ref": "#/$defs/unitObligation"
          }
        }
      },
      "additionalProperties": false
    },
    "migrationArtifacts": {
      "type": "object",
      "required": ["manifest", "sourceClassification", "routeArtifacts", "vddBinding"],
      "properties": {
        "manifest": {
          "$ref": "#/$defs/artifactIdentity"
        },
        "sourceClassification": {
          "$ref": "#/$defs/artifactIdentity"
        },
        "routeArtifacts": {
          "$ref": "#/$defs/routeArtifacts"
        },
        "vddBinding": {
          "$ref": "#/$defs/artifactIdentity"
        },
        "pilotPlaybook": {
          "$ref": "#/$defs/artifactIdentity"
        }
      },
      "additionalProperties": false
    },
    "verification": {
      "type": "object",
      "required": ["mode", "steps"],
      "properties": {
        "mode": {
          "const": "steps"
        },
        "steps": {
          "type": "array",
          "minItems": 1,
          "maxItems": 128,
          "items": {
            "$ref": "#/$defs/step"
          }
        }
      },
      "additionalProperties": false
    },
    "qaFlow": {
      "type": "object",
      "required": ["id", "artifact", "passCriteria"],
      "properties": {
        "id": {
          "$ref": "#/$defs/id"
        },
        "artifact": {
          "allOf": [
            {
              "$ref": "#/$defs/artifactIdentity"
            },
            {
              "properties": {
                "artifactRef": {
                  "pattern": "^qa/"
                }
              }
            }
          ]
        },
        "passCriteria": {
          "type": "array",
          "minItems": 1,
          "maxItems": 128,
          "items": {
            "$ref": "#/$defs/textItem"
          }
        }
      },
      "additionalProperties": false
    },
    "unitObligation": {
      "type": "object",
      "required": ["id", "skillName", "skillFiles", "verification", "qaFlows"],
      "properties": {
        "id": {
          "$ref": "#/$defs/id"
        },
        "skillName": {
          "anyOf": [
            {
              "$ref": "#/$defs/id"
            },
            {
              "type": "null"
            }
          ]
        },
        "skillFiles": {
          "type": "array",
          "maxItems": 8192,
          "items": {
            "$ref": "#/$defs/artifactIdentity"
          }
        },
        "verification": {
          "$ref": "#/$defs/verification"
        },
        "qaFlows": {
          "type": "array",
          "maxItems": 128,
          "items": {
            "$ref": "#/$defs/qaFlow"
          }
        }
      },
      "allOf": [
        {
          "if": {
            "properties": {
              "skillName": {
                "type": "string"
              }
            },
            "required": ["skillName"]
          },
          "then": {
            "properties": {
              "skillFiles": {
                "minItems": 1
              }
            }
          }
        },
        {
          "if": {
            "properties": {
              "skillName": {
                "type": "null"
              }
            },
            "required": ["skillName"]
          },
          "then": {
            "properties": {
              "skillFiles": {
                "maxItems": 0
              }
            }
          }
        }
      ],
      "additionalProperties": false
    }
  }
}
